"DESCRIPTION","DURATION IN MS","NAME","PARENT SUITE","START TIME","STATUS","STOP TIME","SUB SUITE","SUITE","TEST CLASS","TEST METHOD"
"","23526","should complete 3-item purchase","","Mon May 12 20:22:50 BDT 2025","passed","Mon May 12 20:23:13 BDT 2025","","Standard User Test Suite","",""
"","17848","should show error for locked_out_user","","Mon May 12 20:22:50 BDT 2025","passed","Mon May 12 20:23:07 BDT 2025","","Locked User Test Suite","",""
"","2114","should verify successful order message","","Mon May 12 20:23:13 BDT 2025","passed","Mon May 12 20:23:15 BDT 2025","","Standard User Test Suite","",""
"","40577","should complete Z-A sorted purchase","","Mon May 12 20:22:49 BDT 2025","passed","Mon May 12 20:23:30 BDT 2025","","Performance User Test Suite","",""
"","7127","should verify successful order message","","Mon May 12 20:23:30 BDT 2025","passed","Mon May 12 20:23:37 BDT 2025","","Performance User Test Suite","",""
