"DESCRIPTION","DURATION IN MS","NAME","PARENT SUITE","START TIME","STATUS","STOP TIME","SUB SUITE","SUITE","TEST CLASS","TEST METHOD"
"","5708","should verify successful order message","","Thu May 15 19:32:28 BDT 2025","passed","Thu May 15 19:32:34 BDT 2025","","Performance User Test Suite","",""
"","38045","should complete Z-A sorted purchase","","Thu May 15 19:31:50 BDT 2025","passed","Thu May 15 19:32:28 BDT 2025","","Performance User Test Suite","",""
"","1636","should verify successful order message","","Thu May 15 19:32:10 BDT 2025","passed","Thu May 15 19:32:12 BDT 2025","","Standard User Test Suite","",""
"","20324","should complete dynamic product purchase and verify total price","","Thu May 15 19:31:50 BDT 2025","passed","Thu May 15 19:32:10 BDT 2025","","Standard User Test Suite","",""
"","13494","should show error for locked_out_user","","Thu May 15 19:31:50 BDT 2025","passed","Thu May 15 19:32:04 BDT 2025","","Locked User Test Suite","",""
